English,German
As long as he is entitled to the prerogative.,Solange er Anspruch auf das Vorrecht hat.
Chapter III,Kapitel III
Conditions under which mandates are exercised,"Bedingungen, unter denen Mandate ausgeübt werden"
Article 12 conditions under which the function of Member of the Assembly of the Republic is exercised,"Artikel 12 Bedingungen, unter denen die Funktion des Mitglieds der Versammlung der Republik ausgeübt wird"
1 – Members of the Assembly of the Republic shall exercise their mandate freely and shall be,1 - Die Mitglieder der Nationalversammlung sollen ihr Mandat frei ausüben und sollen es
"Ensured the conditions appropriate to the effective exercise of their functions, particularly with regard to the indispensable contact with registered electors, and to being informed regularly.","Sichergestellt wurden die Bedingungen, die für die wirksame Ausübung ihrer Funktionen erforderlich sind, insbesondere im Hinblick auf den unverzichtbaren Kontakt mit registrierten Wählern und regelmäßige Information."
"2 – Each Member of the Assembly of the Republic has the right to appropriate working conditions, particularly:","2 - Jedes Mitglied der Nationalversammlung hat das Recht auf angemessene Arbeitsbedingungen, insbesondere:"
A) his own individualised office at the seat of the Assembly of the Republic;,A) sein eigenes individualisiertes Büro am Sitz der Versammlung der Republik;
"B) An individual assistant, to be recruited as laid down by law;","B) Ein individueller Assistent, der gemäß den gesetzlichen Bestimmungen rekrutiert werden soll;"
C) a dedicated electronic mailbox;,C) ein dediziertes elektronisches Postfach;
D) An individual page on the Assembly of the Republic's website.,D) Eine einzelne Seite auf der Website der Versammlung der Republik.
"3 – Every public entity is subject to the general duty of cooperation with Members of the assembly of the Republic, both in the exercise of their functions and because of them.","3 - Jede öffentliche Einrichtung unterliegt der allgemeinen Pflicht zur Zusammenarbeit mit den Mitgliedern der Versammlung der Republik, sowohl in der Ausübung ihrer Funktionen als auch aufgrund von ihnen."
4 – Departments and services that belong to or are dependent on the central administration,"4 - Abteilungen und Dienste, die zur zentralen Verwaltung gehören oder von ihr abhängig sind."
"Must furnish Members of the Assembly of the Republic with the conditions required for the exercise of their mandates, particularly by supplying such items, information and official","Müssen den Mitgliedern der Versammlung der Republik die für die Ausübung ihrer Mandate erforderlichen Bedingungen zur Verfügung stellen, insbesondere durch Bereitstellung von Gegenständen, Informationen und offiziellen Unterlagen."
"Publications as are requested and, whenever possible, by providing facilities for working meetings, on condition that this does not affect the operation of the department or service itself.","Publikationen werden auf Anfrage erstellt und, wenn möglich, durch Bereitstellung von Räumlichkeiten für Arbeitstreffen, unter der Bedingung, dass dies den Betrieb der Abteilung oder des Dienstes nicht beeinträchtigt."
"5 – When so asked by Members of the Assembly of the Republic, civil governments must provide","5 - Wenn so von Mitgliedern der Nationalversammlung gefragt, müssen Zivilregierungen Informationen bereitstellen."
Appropriate facilities that enable the Members to have direct contact with the media and with the citizens from their constituencies.,"Geeignete Einrichtungen, die es den Mitgliedern ermöglichen, direkten Kontakt mit den Medien und den Bürgern aus ihren Wahlkreisen zu haben."
6 – In the exercise of their functions Members of the Assembly of the Republic have the right to,6 - Bei der Ausübung ihrer Funktionen haben die Mitglieder der Versammlung der Republik das Recht auf
"Use postal services and telecommunications systems free of charge, as well as to the use of the","Nutzung von Postdiensten und Telekommunikationssystemen kostenlos, sowie zur Nutzung der"
Parliamentary it network and other electronic information networks.,Parlamentarisches IT-Netzwerk und andere elektronische Informationsnetzwerke.
"7 – Members of the Assembly of the Republic shall be ensured the use of toll ‐ free lines,",7 - Mitgliedern der Nationalversammlung wird die Nutzung gebührenfreier Telefonleitungen garantiert.
Automatic information systems and other forms of publicising their parliamentary activities and,Automatische Informationssysteme und andere Formen der Veröffentlichung ihrer parlamentarischen Aktivitäten
"Contacting electors, both at the central level and in their constituencies.",Den Kontakt zu Wahlmännern sowohl auf zentraler Ebene als auch in ihren Wahlkreisen herstellen.
8 – The terms and conditions governing the use of each means of communication shall be set by the competent organs of the Assembly of the Republic.,8 - Die Bedingungen für die Nutzung jedes Kommunikationsmittels werden von den zuständigen Organen der Versammlung der Republik festgelegt.
7,7
Article 13 compensation for damages,Artikel 13 Entschädigung für Schäden
"1 – Members of the Assembly of the Republic who, in the exercise of their functions or because","1 - Mitglieder der Nationalversammlung, die in Ausübung ihrer Funktionen oder aufgrund"
"Of them, are victims of acts that imply an offence against their life, physical or moral integrity, freedom or assets have the right to fair compensation.","Von ihnen haben Opfer von Handlungen, die eine Straftat gegen ihr Leben, ihre körperliche oder moralische Unversehrtheit, ihre Freiheit oder ihre Vermögenswerte implizieren, das Recht auf angemessene Entschädigung."
2 – The facts which justify that compensation shall be the object of an inquiry to be ordered by,"2 - Die Tatsachen, die rechtfertigen, dass eine Entschädigung Gegenstand einer Untersuchung ist, die angeordnet werden soll."
"The President of the Assembly of the Republic, who shall decide whether to award the compensation and the amount thereof, save if and to the extent that the damages are covered by other means.","Der Präsident der Versammlung der Republik, der entscheiden wird, ob und in welcher Höhe eine Entschädigung gewährt wird, es sei denn, die Schäden werden durch andere Mittel abgedeckt."
Article 14 duties of Members of the Assembly of the Republic,Artikel 14 Pflichten der Mitglieder der Versammlung der Republik
1 – Members of the Assembly of the Republic have the following duties:,1 - Die Mitglieder der Versammlung der Republik haben folgende Pflichten:
"A) To take part in parliamentary work, and particularly to attend Plenary sittings and",An der parlamentarischen Arbeit teilzunehmen und insbesondere an den Plenarsitzungen teilzunehmen
Meetings of the committees to which they belong;,"Sitzungen der Ausschüsse, zu denen sie gehören;"
B) To perform the offices in the Assembly and the functions that they are elected or appointed to at the proposal of the respective parliamentary groups;,"B) Die Ämter in der Versammlung ausüben und die Funktionen, zu denen sie auf Vorschlag der jeweiligen parlamentarischen Gruppen gewählt oder ernannt wurden, ausführen."
C) To take part in voting;,An der Abstimmung teilnehmen;
D) To ensure the indispensable contact with registered electors;,D) Um den unverzichtbaren Kontakt mit registrierten Wählern sicherzustellen;
E) To respect the dignity of the Assembly of the Republic and its Members;,E) Die Würde der Versammlung der Republik und ihrer Mitglieder zu respektieren;
F) To comply with the Rules of Procedure of the Assembly of the Republic.,Um die Geschäftsordnung der Versammlung der Republik einzuhalten.
"2 – The exercise of any other activities, when legally permissible, may not prejudice the regular","2 - Die Ausübung anderer Tätigkeiten, wenn gesetzlich zulässig, darf die regelmäßige beeinträchtigen."
Fulfilment of the duties provided for in the previous paragraph.,Erfüllung der in dem vorherigen Absatz vorgesehenen Pflichten.
Article 15 rights of Members of the Assembly of the Republic,Artikel 15 Rechte der Mitglieder der Versammlung der Republik
"1 – Members of the Assembly of the Republic's absences from official acts or procedures unrelated to the Assembly, due to Assembly sittings, meetings or missions, shall be sufficient","1 - Die Abwesenheit der Mitglieder der Versammlung der Republik von offiziellen Handlungen oder Verfahren, die nicht mit der Versammlung zusammenhängen, aufgrund von Versammlungen, Sitzungen oder Missionen der Versammlung, ist ausreichend."
"Reason to postpone the said acts or procedures without cost to the Members, but these grounds","Grund zur Verschiebung der genannten Handlungen oder Verfahren ohne Kosten für die Mitglieder, aber diese Gründe."
May not be invoked more than once in relation to each act or procedure.,Darf im Zusammenhang mit jeder Handlung oder jedem Verfahren nicht mehr als einmal in Anspruch genommen werden.
2 – Members of the Assembly of the Republic who attend any officially recognised course at any level of education shall be subject to the most favourable of all the different regimes with regard,"2 - Mitglieder der Versammlung der Republik, die einen offiziell anerkannten Kurs auf jeder Bildungsebene besuchen, unterliegen dem günstigsten aller verschiedenen Regime in Bezug darauf."
"To classes, examinations and the taking of other academic and scientific tests that are provided","Zu Vorlesungen, Prüfungen und dem Absolvieren anderer akademischer und wissenschaftlicher Tests, die angeboten werden."
For in relation to other situations.,In Bezug auf andere Situationen.
3 – Members of the Assembly of the Republic also enjoy the following rights:,Mitglieder der Versammlung der Republik haben auch folgende Rechte:
"A) postponement of military service, civic service and civil mobilisation;","Aufschub des Militärdienstes, des Zivildienstes und der zivilen Mobilmachung;"
"B) Free transit, which is deemed to mean free passage in public places to which access is restricted, upon display of the Member of the Assembly of the Republic's identity card;","B) Freier Transit, der als freie Durchfahrt in öffentlichen Bereichen angesehen wird, zu denen der Zugang beschränkt ist, gegen Vorlage der Identitätskarte des Mitglieds der Versammlung der Republik."
"C) a diplomatic passport per legislature, to be renewed in each legislative session;","C) Ein diplomatischer Reisepass pro Legislaturperiode, der in jeder Legislaturperiode erneuert werden muss."
"D) a Member of the Assembly of the Republic's identity card, the model for and issue of","D) ein Identitätsausweis eines Mitglieds der Versammlung der Republik, das Modell für und die Ausgabe von"
Which shall be determined by order of the President of the Assembly; 11 11 The model and issuance of the Member of the Assembly of the Republic's identity card were laid down in Order no.,Welche durch Anordnung des Präsidenten der Versammlung festgelegt werden soll; Das Modell und die Ausgabe der Identitätskarte des Mitglieds der Versammlung der Republik wurden in der Anordnung Nr. festgelegt.
"94/XI of the President of the Assembly of the Republic, published in Series II ‐ e of the Journal 8","94/XI des Präsidenten der Versammlung der Republik, veröffentlicht in Serie II - e des Journals 8."
E) The remunerations and allowances laid down by law;,E) Die gesetzlich festgelegten Vergütungen und Zulagen;
F) The rights provided for in the legislation governing the protection of maternity and,"F) Die Rechte, die in den Gesetzen zum Schutz der Mutterschaft vorgesehen sind,"
"Paternity; g) The right to use and carry a firearm, in accordance with paragraph (7);","Vaterschaft; g) Das Recht, gemäß Absatz (7) eine Schusswaffe zu benutzen und zu tragen;"
H) Priority in reservations for travel on public air transport companies during periods in,deren Reservierungen für Reisen mit öffentlichen Luftverkehrsgesellschaften während bestimmter Zeiträume priorisiert werden.
"Which the Assembly is in full session, or for reasons related to the performance of their",Wenn die Versammlung in voller Sitzung ist oder aus Gründen im Zusammenhang mit der Ausführung ihrer
Mandate.,Mandat.
4 – In addition to the Member of the Assembly of the Republic's name and signature and the,4 - Neben dem Namen und der Unterschrift des Mitglieds der Versammlung der Republik sowie der
"Signature of the President of the Assembly, the Member's identity card shall include the validity","Unterschrift des Präsidenten der Versammlung, die Identitätskarte des Mitglieds soll die Gültigkeit enthalten."
"Date determined by the Member's term of office, together with the number of his national identity card or citizen's card.","Datum, das durch die Amtszeit des Mitglieds bestimmt wird, zusammen mit der Nummer seines Personalausweises oder Bürgerschaftsausweises."
5 – The integrated circuit of the Member of the Assembly of the Republic's identity card shall,5 - Der integrierte Schaltkreis des Personalausweises des Mitglieds der Versammlung der Republik soll
"Include the software for electronic voting, together with the qualified certificate for electronic signature, and other elements that are indispensable to any new software that may be incorporated into it.","Fügen Sie die Software für die elektronische Abstimmung zusammen mit dem qualifizierten Zertifikat für die elektronische Signatur und anderen Elementen hinzu, die für jede neue Software unerlässlich sind, die darin integriert werden kann."
"6 – When a Member of the Assembly of the Republic's term of office ends or is suspended, his","6 - Wenn die Amtszeit eines Mitglieds der Versammlung der Republik endet oder ausgesetzt wird, seine"
Diplomatic passport and Member's identity card must immediately be returned to the President of the Assembly.,Diplomatischer Reisepass und Mitgliedsausweis müssen umgehend an den Präsidenten der Versammlung zurückgegeben werden.
"7 – For the purposes of the rules governing the possession of, permits for, and the use and carriage of firearms and their munitions, Members of the Assembly of the Republic are subject","7 - Für die Zwecke der Regeln, die den Besitz, die Genehmigungen für und den Gebrauch und Transport von Schusswaffen und Munition regeln, unterliegen die Mitglieder der Versammlung der Republik."
To the provisions of Article 5 of Law no.,Zu den Bestimmungen des Artikels 5 des Gesetzes Nr.
5/2006 of 23 February 2006.,5/2006 vom 23. Februar 2006.
"Article 16 allowances 1 – In the exercise of their functions and because of them, Members of the Assembly of the",Article 16 Zulagen 1 - Bei der Ausübung ihrer Funktionen und aufgrund derselben erhalten Mitglieder der Versammlung der
Republic have the right to the following allowances:,Die Republik hat Anspruch auf folgende Zulagen:
A) Travel allowances during the Assembly of the Republic's parliamentary term;,Reisekostenzuschüsse während der Amtszeit des Parlaments der Republik;
"B) Allowances in support of political work throughout the national territory, in","B) Zuschüsse zur Unterstützung politischer Arbeit im gesamten Bundesgebiet, in"
Accordance with Article 152 (2) of the Constitution of the Portuguese Republic; C) Travel allowances for political work in constituencies.,Gemäß Artikel 152 Absatz 2 der Verfassung der Portugiesischen Republik; C) Reisekostenzuschüsse für politische Arbeit in Wahlkreisen.
2 – The allowance provided for in Article 16 (1) (a) shall include an allowance for travel expenses,2 - Die in Artikel 16 Absatz 1 Buchstabe a vorgesehene Zulage umfasst eine Zulage für Reisekosten.
And other expense allowances.,Und andere Spesenpauschalen.
Its allocation shall be dependent on the submission of proof of execution.,Die Zuweisung erfolgt abhängig von der Vorlage des Nachweises der Durchführung.
3 – The allowance provided for in Article 16 (1) (b) shall be determined as an overall annual amount and processed on a monthly basis.,3 - Die in Artikel 16 Absatz 1 Buchstabe b vorgesehene Vergütung wird als Gesamtbetrag pro Jahr festgelegt und monatlich verarbeitet.
4 – The allowance provided for in Article 16 (1) (c) shall be allocated to those Members of the assembly of the Republic with funds subject to personal income tax.,"4 - Der in Artikel 16 (1) (c) vorgesehene Zuschuss wird den Mitgliedern der Versammlung der Republik mit Mitteln zugewiesen, die der Einkommensteuer unterliegen."
"Of the Assembly of the Republic, no.","Von der Versammlung der Republik, Nr."
5 of 7 December 2010.,5. bis 7. Dezember 2010.
"However, the Assembly of the Republic's certifying Entity (ECAR) was extinguished.",Allerdings wurde das Zertifizierungsorgan der Versammlung der Republik (ECAR) aufgelöst.
"It was replaced by the Assembly of the Republic's Registration entity (ERAR) and, therefore, this order is outdated.",Es wurde durch die Registrierungsstelle der Versammlung der Republik (ERAR) ersetzt und ist daher veraltet.
"9 5 – In the following situations arising from specific parliamentary activities, Members of the","9 5 - In den folgenden Situationen, die aus spezifischen parlamentarischen Aktivitäten entstehen, sind Mitglieder des"
Assembly of the Republic shall be entitled to allowances for travel and accommodation,Die Versammlung der Republik hat Anspruch auf Reise- und Unterkunftspauschalen.
"Expenses, as well as other expense allowances, subject to authorisation and proof of execution: a) Travel for political work in the case of Members who are elected for the emigrant constituencies;","Ausgaben sowie andere Ausgabenpauschalen, die der Genehmigung und dem Nachweis der Durchführung unterliegen: a) Reisen für politische Arbeit im Falle von Mitgliedern, die für die Auslands-Wahlkreise gewählt wurden;"
B) Travel for institutional representation of the Assembly of the Republic; C) Travel by delegations to international bodies of which the Assembly of the Republic is,"B) Reisen zur institutionellen Vertretung der Versammlung der Republik; C) Reisen von Delegationen zu internationalen Gremien, an denen die Versammlung der Republik beteiligt ist."
"A member, and to parliamentary missions abroad.",Ein Mitglied und zu parlamentarischen Missionen im Ausland.
6 – The allowance scheme provided for in this Statute is implemented and complemented by a,6 - Das im Statut vorgesehene Zulagensystem wird umgesetzt und ergänzt durch eine
"Resolution of the Assembly of the Republic and corresponds, for all legal intents and purposes,",Resolution der Versammlung der Republik und entspricht für alle rechtlichen Zwecke und Absichten.
To a special scheme resulting from the constitutional nature of the parliamentary mandate.,"Zu einem besonderen Schema, das sich aus der verfassungsmäßigen Natur des parlamentarischen Mandats ergibt."
7 – The resolution provided for in the foregoing paragraph also regulates the terms and,conditions for terminating the agreement.
Conditions governing the use of official vehicles by Members of the Assembly of the Republic,Bedingungen für die Nutzung von Dienstfahrzeugen durch Mitglieder der Nationalversammlung
Due to their position or parliamentary mission.,Aufgrund ihrer Position oder parlamentarischen Aufgabe.
Article 16 ‐ a expense allowances,Artikel 16 - Ausgabenpauschale
1 – The expense allowances provided for in Article 16 (2) shall be those laid down in the following,1 - Die Ausgabenpauschalen gemäß Artikel 16 Absatz 2 sind die in folgenden festgelegten.
"Paragraphs, without prejudice to other regulatory rules governing allowance discipline.","Absätze, ohne Beeinträchtigung anderer regulatorischer Regeln, die die Zulagendisziplin regeln."
"2 – Members of the Assembly of the Republic residing outside the municipalities of Lisbon,","2 - Mitglieder der Versammlung der Republik, die außerhalb der Gemeinden von Lissabon wohnen,"
"Odivelas shall be entitled to expense allowances established for members of the Government,",Odivelas hat Anspruch auf die für Regierungsmitglieder festgelegten Ausgabenpauschalen.
"Paid per each day of attendance of plenary sittings, committees or other meetings convened by the President of the Assembly of the Republic and two additional days per week.","Bezahlt pro Tag der Teilnahme an Vollversammlungen, Ausschüssen oder anderen Sitzungen, die vom Präsidenten der Nationalversammlung einberufen wurden, sowie zwei zusätzliche Tage pro Woche."
"3 – Members of the Assembly of the Republic who reside in the municipalities of Lisbon, Oeiras,","3 - Mitglieder der Versammlung der Republik, die in den Gemeinden Lissabon, Oeiras,"
"Cascais, Loures, Sintra, Vila franca de Xira, Almada, Seixal, Barreiro, Amadora and Odivelas shall be entitled to a third of the expense allowances established in the foregoing paragraph.","Cascais, Loures, Sintra, Vila Franca de Xira, Almada, Seixal, Barreiro, Amadora und Odivelas haben Anspruch auf ein Drittel der im vorherigen Absatz festgelegten Ausgabenpauschalen."
"Article 16 ‐ b actual residence 1 – The actual residence of a Member of the Assembly of the Republic, which is relevant for","Artikel 16 - b tatsächlicher Wohnsitz 1 - Der tatsächliche Wohnsitz eines Mitglieds der Versammlung der Republik, der relevant ist für"
"Determining allowances, shall be his/her place of habitual residence in accordance with the",Die Bestimmung von Zulagen erfolgt gemäß seinem/ihrer gewöhnlichen Aufenthaltsort.
Address recorded in the information contained in the citizen's card integrated circuit.,"Adresse, die in den Informationen enthalten ist, die im integrierten Schaltkreis der Bürgerkarte gespeichert sind."
2 – The relevant residence for the purpose of determining allowances allocated to Members,2 - Der maßgebliche Wohnsitz zur Bestimmung der den Mitgliedern zugewiesenen Zulagen
"Who are elected for the emigrant constituencies, if located outside the Portuguese territory shall","Wer wird für die Auswanderungswähler gewählt, wenn sie sich außerhalb des portugiesischen Territoriums befinden?"
"Be, during the whole mandate, the Member's stable residence on the date of the election, after","Sei, während des gesamten Mandats, der stabile Wohnsitz des Mitglieds am Tag der Wahl."
Certification by the relevant consular services.,Zertifizierung durch die entsprechenden konsularischen Dienste.
"For this purpose, determining a different domicile for personal income tax purposes is irrelevant.","Zu diesem Zweck ist es unerheblich, einen anderen Wohnsitz für steuerliche Zwecke des persönlichen Einkommens festzulegen."
3 – Members of the Assembly of the Republic who are elected for constituencies in Portuguese,"3 - Mitglieder der Versammlung der Republik, die für Wahlkreise in Portugal gewählt werden."
Territory and who are residing abroad must choose a domicile within Portuguese territory for the purpose of allocating and processing allowances.,"Personen, die im Ausland leben und ihren Wohnsitz in Portugal haben, müssen einen Wohnsitz innerhalb des portugiesischen Gebiets wählen, um Zulagen zuzuweisen und zu bearbeiten."
10,10
Article 16 ‐ C,Artikel 16 - C
Insurance and assistance 1 – When Members of the Assembly of the Republic are on official missions abroad they shall be entitled to life insurance in an amount to be set by the Board of Administration of the assembly.,"Versicherung und Unterstützung 1 - Wenn Mitglieder der Nationalversammlung auf offiziellen Missionen im Ausland sind, haben sie Anspruch auf eine Lebensversicherung in Höhe, die vom Verwaltungsrat der Versammlung festgelegt wird."
"2 – Subject to a favourable written opinion from the Board of Administration of the Assembly,",2 - Vorbehaltlich einer günstigen schriftlichen Stellungnahme des Verwaltungsrates der Versammlung.
The Assembly of the Republic may take out an insurance policy that covers the travel risks that,"Die Versammlung der Republik kann eine Versicherung abschließen, die Reiserisiken abdeckt."
Members run in Portugal or as may arise from missions abroad.,Mitglieder betreiben in Portugal oder wie sich aus Missionen im Ausland ergeben kann.
3 – When Members of the Assembly of the Republic are on official journeys or journeys which,"3 - Wenn Mitglieder der Versammlung der Republik auf offiziellen Reisen oder Reisen sind, die"
"The Conference of leaders deems to be of parliamentary interest, the Assembly shall bear the costs of any emergency medical assistance.","Die Konferenz der Führungskräfte hält es für parlamentarisch interessant, dass die Versammlung die Kosten für jegliche notfallmedizinische Hilfe trägt."
Article 17,Artikel 17
Use of postal and communications services revoked.,Die Nutzung von Post- und Kommunikationsdiensten wurde widerrufen.
Article 18,Artikel 18
Social security regime 1 – Members of the Assembly of the Republic shall enjoy the benefits of the general social security regime.,Sozialversicherungsregime 1 - Die Mitglieder der Nationalversammlung genießen die Vorteile des allgemeinen Sozialversicherungsregimes.
"2 – In cases in which Members of the Assembly of the Republic opt for the social security regime applicable to their profession, the Assembly of the Republic shall bear the costs that would otherwise be borne by the employer.","2 - In Fällen, in denen Mitglieder der Versammlung der Republik sich für das Sozialversicherungssystem entscheiden, das für ihren Beruf gilt, trägt die Versammlung der Republik die Kosten, die normalerweise vom Arbeitgeber getragen würden."
Article 19,Artikel 19
Guarantees with regard to work and social benefits,Garantien in Bezug auf Arbeit und soziale Leistungen
