English,German
"1 – In the exercise of their functions and because of them, Members of the Assembly of the Republic have the right to the following allowances:",1 - Bei der Ausübung ihrer Funktionen und aufgrund derselben haben die Mitglieder der Nationalversammlung das Recht auf folgende Zulagen:
A) Travel allowances during the Assembly of the Republic's parliamentary term;,Reisekostenzuschüsse während der parlamentarischen Amtszeit der Nationalversammlung;
"B) Allowances in support of political work throughout the national territory, in",) Zulagen zur Unterstützung politischer Arbeit im gesamten Staatsgebiet.
Accordance with Article 152 (2) of the Constitution of the Portuguese Republic;,Gemäß Artikel 152 (2) der Verfassung der Portugiesischen Republik;
C) Travel allowances for political work in constituencies.,C) Reisekostenzuschüsse für politische Arbeit in Wahlkreisen.
2 – The allowance provided for in Article 16 (1) (a) shall include an allowance for travel expenses,2 - Die im Artikel 16 Absatz 1 Buchstabe a vorgesehene Zulage umfasst eine Zulage für Reisekosten.
And other expense allowances.,Und andere Ausgabenpauschalen.
Its allocation shall be dependent on the submission of proof of execution.,Die Zuteilung erfolgt abhängig von der Vorlage des Nachweises der Ausführung.
3 – The allowance provided for in Article 16 (1) (b) shall be determined as an overall annual amount and processed on a monthly basis.,3 - Der in Artikel 16 Absatz 1 Buchstabe b vorgesehene Zuschuss wird als Gesamtbetrag pro Jahr festgelegt und monatlich bearbeitet.
4 – The allowance provided for in Article 16 (1) (c) shall be allocated to those Members of the assembly of the Republic with funds subject to personal income tax.,"4 - Die in Artikel 16 Absatz 1 Buchstabe c vorgesehene Zulage wird jenen Mitgliedern der Versammlung der Republik zugeteilt, die Einkommensteuerpflichtig sind."
"Of the Assembly of the Republic, no.","Von der Versammlung der Republik, Nr."
5 of 7 December 2010.,5. bis 7. Dezember 2010.
"However, the Assembly of the Republic's certifying Entity (ECAR) was extinguished.",Allerdings wurde das Zertifizierungsorgan der Nationalversammlung (ECAR) aufgelöst.
"It was replaced by the Assembly of the Republic's Registration entity (ERAR) and, therefore, this order is outdated.","Es wurde durch die Registrierungsstelle der Nationalversammlung (ERAR) ersetzt, daher ist dieser Beschluss veraltet."
9,9
"5 – In the following situations arising from specific parliamentary activities, Members of the","5 - In den folgenden Situationen, die aus spezifischen parlamentarischen Aktivitäten resultieren, sind Mitglieder des"
Assembly of the Republic shall be entitled to allowances for travel and accommodation,Die Versammlung der Republik hat Anspruch auf Reise- und Unterkunftskosten.
"Expenses, as well as other expense allowances, subject to authorisation and proof of execution: a) Travel for political work in the case of Members who are elected for the emigrant constituencies;","Ausgaben sowie andere Ausgabenpauschalen, die der Genehmigung und dem Nachweis der Durchführung unterliegen: a) Reisen für politische Arbeit im Falle von Mitgliedern, die für die ausländischen Wahlkreise gewählt werden;"
B) Travel for institutional representation of the Assembly of the Republic;,B) Reisen zur institutionellen Vertretung der Versammlung der Republik;
"C) Travel by delegations to international bodies of which the Assembly of the Republic is a member, and to parliamentary missions abroad.","C) Reisen von Delegationen zu internationalen Gremien, von denen die Versammlung der Republik Mitglied ist, und zu parlamentarischen Missionen im Ausland."
6 – The allowance scheme provided for in this Statute is implemented and complemented by a,6 - Das im Statut vorgesehene Zulagensystem wird durchgeführt und ergänzt von einer
"Resolution of the Assembly of the Republic and corresponds, for all legal intents and purposes,",Beschluss der Vollversammlung der Republik und entspricht für alle rechtlichen Zwecke und Absichten.
7 – The resolution provided for in the foregoing paragraph also regulates the terms and conditions governing the use of official vehicles by Members of the Assembly of the Republic due to their position or parliamentary mission.,7 - Die in dem vorstehenden Absatz vorgesehene Regelung regelt auch die Bedingungen für die Nutzung von Dienstfahrzeugen durch Mitglieder der Nationalversammlung aufgrund ihrer Funktion oder parlamentarischen Mission.
Article 16 ‐ a expense allowances,Artikel 16 - Aufwandsentschädigungen
1 – The expense allowances provided for in Article 16 (2) shall be those laid down in the following,1 - Die Ausgabenpauschalen gemäß Artikel 16 Absatz 2 sind in den folgenden festgelegt.
"Paragraphs, without prejudice to other regulatory rules governing allowance discipline.","Absätze, ohne Beeinträchtigung anderer regulatorischer Vorschriften zur Regelung der Zulagen-Disziplin."
"2 – Members of the Assembly of the Republic residing outside the municipalities of Lisbon,","2 - Mitglieder der Versammlung der Republik, die außerhalb der Gemeinden Lissabons ansässig sind."
"Odivelas shall be entitled to expense allowances established for members of the Government,",Odivelas hat Anspruch auf die festgelegten Aufwandsentschädigungen für Mitglieder der Regierung.
"Paid per each day of attendance of plenary sittings, committees or other meetings convened by the President of the Assembly of the Republic and two additional days per week.","Bezahlt pro jeden Tag der Teilnahme an Plenarsitzungen, Ausschüssen oder anderen Sitzungen, die vom Präsidenten der Nationalversammlung einberufen werden, sowie zwei zusätzliche Tage pro Woche."
"3 – Members of the Assembly of the Republic who reside in the municipalities of Lisbon, Oeiras,","3 - Mitglieder der Versammlung der Republik, die in den Gemeinden Lissabon, Oeiras,"
"Cascais, Loures, Sintra, Vila franca de Xira, Almada, Seixal, Barreiro, Amadora and Odivelas shall be entitled to a third of the expense allowances established in the foregoing paragraph.","Cascais, Loures, Sintra, Vila Franca de Xira, Almada, Seixal, Barreiro, Amadora und Odivelas haben Anspruch auf ein Drittel der im vorherigen Absatz festgelegten Ausgabenpauschalen."
Article 16 ‐ b actual residence,Artikel 16 - b tatsächlicher Wohnsitz
"1 – The actual residence of a Member of the Assembly of the Republic, which is relevant for","1 - Der tatsächliche Wohnsitz eines Mitglieds der Versammlung der Republik, der relevant ist für"
"Determining allowances, shall be his/her place of habitual residence in accordance with the",Bestimmung von Zulagen erfolgt gemäß seinem/ihrem gewöhnlichen Aufenthaltsort entsprechend der
Address recorded in the information contained in the citizen's card integrated circuit.,"Adresse, die in den Informationen enthalten ist, die im integrierten Schaltkreis der Bürgerkarte aufgezeichnet sind."
2 – The relevant residence for the purpose of determining allowances allocated to Members,2 - Der maßgebliche Wohnsitz zur Bestimmung der Mitgliedern zugewiesenen Zulagen
"Who are elected for the emigrant constituencies, if located outside the Portuguese territory shall be, during the whole mandate, the Member's stable residence on the date of the election, after certification by the relevant consular services.","Wer in den Wahlkreisen für Auswanderer gewählt wird, die sich außerhalb des portugiesischen Territoriums befinden, muss während des gesamten Mandats seinen festen Wohnsitz an dem Tag haben, an dem die Wahl stattfindet, nach Bestätigung durch die zuständigen Konsulardienste."
"For this purpose, determining a different domicile",Zu diesem Zweck die Bestimmung eines anderen Wohnsitzes
For personal income tax purposes is irrelevant.,Für die persönliche Einkommensteuer ist dies irrelevant.
3 – Members of the Assembly of the Republic who are elected for constituencies in Portuguese,"3 - Mitglieder der Versammlung der Republik, die für Wahlkreise in Portugal gewählt werden"
Territory and who are residing abroad must choose a domicile within Portuguese territory for the purpose of allocating and processing allowances.,"Personen, die im Ausland leben und arbeiten, müssen einen Wohnsitz innerhalb des portugiesischen Hoheitsgebiets wählen, um Zulagen zuzuweisen und zu bearbeiten."
10 Article 16 ‐ C insurance and assistance,10 Artikel 16 ‐ Versicherung und Unterstützung
1 – When Members of the Assembly of the Republic are on official missions abroad they shall be entitled to life insurance in an amount to be set by the Board of Administration of the assembly.,"1 - Wenn Mitglieder der Nationalversammlung auf offiziellen Missionen im Ausland sind, haben sie Anspruch auf eine Lebensversicherung in Höhe, die vom Verwaltungsrat der Nationalversammlung festgelegt wird."
"2 – Subject to a favourable written opinion from the Board of Administration of the Assembly,",2 - Vorbehaltlich einer günstigen schriftlichen Stellungnahme des Verwaltungsrats der Versammlung.
The Assembly of the Republic may take out an insurance policy that covers the travel risks that,"Die Versammlung der Republik kann eine Versicherung abschließen, die die Reiserisiken abdeckt."
Members run in Portugal or as may arise from missions abroad.,Mitglieder laufen in Portugal oder wie es sich aus Missionen im Ausland ergeben kann.
3 – When Members of the Assembly of the Republic are on official journeys or journeys which,"3 - Wenn Mitglieder der Nationalversammlung auf offiziellen Reisen oder Reisen sind, die"
"The Conference of leaders deems to be of parliamentary interest, the Assembly shall bear the costs of any emergency medical assistance.","Die Konferenz der Führer hält es für parlamentarisch interessant, dass die Versammlung die Kosten für jegliche Notfallmedizinische Hilfe trägt."
Article 17 use of postal and communications services revoked.,Artikel 17 Nutzung von Post- und Kommunikationsdiensten widerrufen.
Article 18,Artikel 18
Social security regime,Sozialversicherungsregime
1 – Members of the Assembly of the Republic shall enjoy the benefits of the general social security regime.,1 - Die Mitglieder der Versammlung der Republik genießen die Vorteile des allgemeinen Sozialversicherungssystems.
2 – In cases in which Members of the Assembly of the Republic opt for the social security regime,"2 - In Fällen, in denen Mitglieder der Nationalversammlung sich für das Sozialversicherungssystem entscheiden."
"Applicable to their profession, the Assembly of the Republic shall bear the costs that would otherwise be borne by the employer.","Für ihren Beruf zutreffend, trägt die Versammlung der Republik die Kosten, die normalerweise vom Arbeitgeber getragen würden."
Article 19,Artikel 19
Guarantees with regard to work and social benefits,Garantien in Bezug auf Arbeits- und Sozialleistungen
1 – Members of the Assembly of the Republic may not be prejudiced in their professional,1 - Mitglieder der Nationalversammlung dürfen in ihrer beruflichen Tätigkeit nicht benachteiligt werden.
"Assignments, social benefits or permanent employment due to the fulfilment of their mandate.","Aufgaben, Sozialleistungen oder feste Anstellung aufgrund der Erfüllung ihres Mandats."
2 – Members of the Assembly of the Republic have the right to be dispensed from all,"2 - Mitglieder der Nationalversammlung haben das Recht, von allem befreit zu werden"
"Professional, public and private activities during the legislature.","Berufliche, öffentliche und private Aktivitäten während der Legislaturperiode."
"3 – Fulfilment of the mandate shall count towards length of service for all purposes, save those","3 – Die Erfüllung des Mandats zählt für alle Zwecke zur Dienstzeit, mit Ausnahme von denen."
"That presuppose the actual exercise of a profession, without prejudice to the provisions of Article 5 (4).","Das setzt die tatsächliche Ausübung eines Berufs voraus, ohne Beeinträchtigung der Bestimmungen des Artikels 5 (4)."
"4 – In the case of a function that is temporary by law or by contract, fulfilment of a Member of the Assembly of the Republic's mandate shall suspend the counting of the respective time period.","4 - Im Falle einer Funktion, die gesetzlich oder vertraglich befristet ist, wird die Erfüllung des Mandats eines Mitglieds der Nationalversammlung die Zählung des jeweiligen Zeitraums aussetzen."
Article 20 incompatibilities,Artikel 20 Unverträglichkeiten
"1 – The following positions and functions are incompatible with the exercise of the mandate of Member of the Assembly of the Republic: a) President of the Republic, member of the Government, and Representative of the","1 - Die folgenden Positionen und Funktionen sind unvereinbar mit der Ausübung des Mandats als Mitglied der Versammlung der Republik: a) Präsident der Republik, Mitglied der Regierung und Vertreter des."
Republic to an Autonomous Region;,Republik zu einer autonomen Region;
"11 b) Member of the Constitutional Court, the Supreme Court of Justice, the Supreme","11 b) Mitglied des Verfassungsgerichts, des Obersten Gerichtshofs, des Obersten Bundesgerichts"
"Administrative Court, the Court of Audit, the Supreme Judicial Council, the Supreme","Verwaltungsgericht, Rechnungshof, Oberster Justizrat, Oberstes Gericht"
"Council of the Administrative and Fiscal Courts, attorney General, and Ombudsman;","Rat der Verwaltungs- und Finanzgerichte, Generalstaatsanwalt und Ombudsmann;"
C) Member of the European Parliament;,C) Mitglied des Europäischen Parlaments;
D) Member of the self ‐ government organs of Autonomous Regions;,D) Mitglied der Selbstverwaltungsorgane der autonomen Regionen;
"E) Ambassador, unless the Member of the Assembly of the Republic is a career Diplomat;","E) Botschafter, es sei denn, das Mitglied der Versammlung der Republik ist ein Berufsdiplomat;"
F) Civil Governor and Deputy Civil Governor;,F) Zivilgouverneur und stellvertretender Zivilgouverneur;
"G) Mayor, deputy Mayor, legal substitute for the Mayor, and municipal Councillor, either","G) Bürgermeister, stellvertretender Bürgermeister, rechtlicher Vertreter des Bürgermeisters und Stadtrat."
Full ‐ or part ‐ time;,Vollzeit- oder Teilzeit-;
H) Employee of the state or another public legal person;,H) Mitarbeiter des Staates oder einer anderen öffentlich-rechtlichen Person;
I) Member of the National Electoral Commission;,Mitglied der Nationalen Wahlkommission;
J) Member of a ministerial office or legally equivalent position;,J) Mitglied eines Ministerbüros oder einer rechtlich gleichwertigen Position;
"L) Holder of a senior international office or function, if it prevents exercise of the parliamentary mandate, and employee of an international organisation or foreign state;","Inhaber eines leitenden internationalen Amtes oder einer Funktion, wenn dies die Ausübung des parlamentarischen Mandats verhindert, und Mitarbeiter einer internationalen Organisation oder eines ausländischen Staates;"
M) President and vice ‐ President of the Economic and Social Council;,Präsident und Vizepräsident des Wirtschafts- und Sozialrats;
N) Member of the Media Regulatory Body;,N) Mitglied des Medienregulierungsgremiums;
"O) Member of the board of directors of a public ‐ sector company, of a company with public capital or in which the state holds a majority stake, or of an autonomous public Institute.","O) Mitglied des Verwaltungsrats eines öffentlichen Unternehmens, eines Unternehmens mit öffentlichem Kapital oder an dem der Staat die Mehrheitsbeteiligung hält, oder eines autonomen öffentlichen Instituts."
2 – The provisions of subparagraph (h) of the previous paragraph do not encompass the exercise,2 - Die Bestimmungen des Unterabsatzes (h) des vorherigen Absatzes umfassen nicht die Ausübung.
"Without charge of higher education teaching functions, research work and other similar activities","Ohne Gebühr für Hochschullehrerfunktionen, Forschungsarbeiten und andere ähnliche Aktivitäten."
That are of important social interest and are recognised as such on a case ‐ by ‐ case basis by the Ethics Committee of the Assembly of the Republic.,"Das sind wichtige soziale Interessen, die vom Ethikkomitee der Versammlung der Republik von Fall zu Fall anerkannt werden."
3 – Without prejudice to the provisions of Article 4 (1) (a) and (2) and following implementation,3 - Unbeschadet der Bestimmungen von Artikel 4 (1) (a) und (2) und deren Umsetzung
"Of the provisions of Article 21 (7), the exercise of an incompatible position or function shall imply the loss of the Member of the Assembly of the Republic's seat.",Von den Bestimmungen des Artikels 21 (7) bedeutet die Ausübung einer unvereinbaren Position oder Funktion den Verlust des Sitzes des Mitglieds der Versammlung der Republik.
Article 21 disqualifications,Artikel 21 Ausschlussgründe
"1 – Members of the Assembly of the Republic require the Assembly's authorisation in order to be jurors, expert witnesses or witnesses.","1 - Mitglieder der Versammlung der Republik benötigen die Genehmigung der Versammlung, um Geschworene, Sachverständige oder Zeugen zu sein."
2 – Members of the Assembly of the Republic require the Assembly's authorisation in order to serve as arbiters in proceedings in which the state or any other public ‐ law legal person is a party.,"2 - Mitglieder der Versammlung der Republik benötigen die Genehmigung der Versammlung, um als Schiedsrichter in Verfahren tätig zu werden, in denen der Staat oder eine andere öffentlich-rechtliche juristische Person beteiligt ist."
3 – The authorisation referred to in paragraph (1) must be requested by the competent judge or,3 - Die Genehmigung gemäß Absatz (1) muss vom zuständigen Richter oder... beantragt werden.
"By the official responsible for the committal proceedings, in the form of a document addressed to the President of the Assembly of the Republic, and the Member in question shall be heard prior to the decision as to whether to grant the authorisation.","Von dem für das Verfahren zur Festnahme Verantwortlichen in Form eines Dokuments, das an den Präsidenten der Versammlung der Republik gerichtet ist, und das betroffene Mitglied soll vor der Entscheidung angehört werden, ob die Genehmigung erteilt wird."
"4 – Members of the Assembly of the Republic may exercise other activities, on condition that","4 - Mitglieder der Nationalversammlung können andere Tätigkeiten ausüben, unter der Bedingung, dass"
"They are not excluded by the provisions of the following paragraphs, and they must notify the constitutional Court of the nature and details thereof.","Sie werden nicht von den Bestimmungen der folgenden Absätze ausgeschlossen, und sie müssen dem Verfassungsgericht die Art und Einzelheiten davon mitteilen."
5 – Without prejudice to the provisions of the regimes governing incompatibilities and,5 - Unbeschadet der Bestimmungen der Regimes über Unvereinbarkeiten und
"Disqualifications set out in special laws, particularly with regard to the exercise of positions or","Ausschlussgründe, die in speziellen Gesetzen festgelegt sind, insbesondere in Bezug auf die Ausübung von Positionen oder"
"Professional activities, the following situations shall also preclude the exercise of the mandate of Member of the Assembly of the Republic: 12","Berufliche Tätigkeiten, die folgenden Situationen sollen auch das Ausüben des Mandats als Mitglied der Versammlung der Republik ausschließen: 12"
"A) Holding a position as member of a corporate organ of a public legal person, or of a",B) Ein Mitglied eines Unternehmensorgans einer öffentlichen juristischen Person oder eines
"Company whose capital is wholly or majority held by the public sector, or of a company that holds a public service concession, with the exception of a consultative, scientific or","Unternehmen, dessen Kapital vollständig oder mehrheitlich im Besitz des öffentlichen Sektors ist, oder eines Unternehmens, das eine öffentliche Dienstleistungskonzession innehat, mit Ausnahme eines beratenden, wissenschaftlichen oder"
Pedagogical organ or one that forms part of the autonomous institutional,"Pädagogisches Organ oder eines, das Teil der autonomen Institution ist"
Administration;,Verwaltung;
B) Serving as a paid expert or arbiter in any proceedings in which the state or other,"B) Als bezahlter Experte oder Schiedsrichter in allen Verfahren zu dienen, in denen der Staat oder andere beteiligt sind."
Public ‐ law legal persons are a party;,Öffentlich-rechtliche juristische Personen sind eine Partei.
"C) Holding a government appointment, acceptance of which has not been authorised by","C) Die Übernahme eines Regierungsamtes, dessen Annahme nicht genehmigt wurde."
The parliamentary committee with competence for the matter in question.,Der parlamentarische Ausschuss mit Zuständigkeit für die betreffende Angelegenheit.
"6 – Without prejudice to the provisions of special laws, Members of the Assembly of the Republic are also precluded from accumulating the following activities with that of Member:",6 - Unbeschadet der Bestimmungen spezieller Gesetze dürfen Mitglieder der Nationalversammlung auch nicht die folgenden Tätigkeiten mit der eines Mitglieds vereinbaren:
"A) In the case of the direct or indirect exercise of commercial or industrial activities, with a spouse from whom the Member of the Assembly of the Republic is not judicially","Im Falle der direkten oder indirekten Ausübung von Handels- oder Industrietätigkeiten mit einem Ehepartner, von dem das Mitglied der Nationalversammlung nicht gerichtlich ist."
"Separated from bed and board, or for or on his own behalf or that of an entity in which","Getrennt von Bett und Tisch, oder für oder im eigenen Namen oder im Namen einer Einheit, in der"
